url,name,price,rating,number_of_rating,description,asin,product_description,manufacturer
https://www.amazon.in/HAMMONDS-FLYCATCHER-Genuine-Shoulder-Messenger/dp/B07P2TQH78/ref=sr_1_72?crid=2M096C61O4MLT&keywords=bags&qid=1679388596&sprefix=ba%2Caps%2C283&sr=8-72,"Hammonds Flycatcher Genuine Leather Laptop Bag for Men/Office Bag for Men, Brown | Fits Upto 16 Inch Laptop/MacBook| Leather Bag with Shoulder Straps | Laptop Messenger Bag/Leather Bag for Men |","2,599",4.3,"(4,682)","GENUINE LEATHER: This laptop bag for men / office bag for men is made of 100% Full Grain Genuine Leather. We will gladly reward 100 Times the value of the product upon certification from any accredited labs like ""SGS"" or ""CLRI"" if proven otherwise.
FEATURES OF LAPTOP BAG FOR MEN: Fits up Upto 16 Inch Laptop | Padded & adjustable shoulder Straps | Padded Laptop Compartment | 1 Main Compartments | Brand's Brass Rivits | Heavy Duty Antirust Metal Fittings | Brand's Jacquard Fabrics | Brand's zippers & sliders | Stitched by a quality nylon thread. | 2 Grab Handles | Dimension: L - 43 B - 9 H - 31 cm | Water Resistance Level: Water Resistant
DESIGN DECENCY OFFICE BAG FOR MEN: This Hammonds Flycatcher genuine leather bag for men is designed by our professional designers which set you apart and outstandingly positioned in the crowd, makes you stand out an organized person. These are not Vegan Leather which will contain shine on its surface. Start your journey now with this leather bag for men as a messenger bag, shoulder bag, office bag , briefcase or laptop bag. Suitable for your school, office, college, & business for everyday use.
MULTI-FUNCTIONAL COMPARTMENT: Roomy compartments in Flycatcher office bag for men provides separated space for your 16” Laptop/MacBook/notebook files, pens, wallet and all your items. This office bags for men has padded laptop compartment that offers perfect protection for your laptop from accidental bumps and shocks.
PERFECT GIFT: This laptop bag for men is a great gift idea for Father's Day, Birthdays, Valentine's Day, Christmas, Graduation, Back To College Or Any Occasion Which Calls For A Gift . This office bags for men makes a great gift for professionals, artists, students, and all sorts of officials.
",B07P2TQH78,,HAMMONDS FLYCATCHER
https://www.amazon.in/Tabelito-Laptop-Backpack-15-6-inch-Repellent/dp/B08Y3KCN32/ref=sr_1_73?crid=2M096C61O4MLT&keywords=bags&qid=1679388596&sprefix=ba%2Caps%2C283&sr=8-73,"Tabelito® Casual 15.6 Inch Laptop Bag (39.6cm), 25 LTR Water Repellent Backpack Laptop Apple/ Dell/ Lenovo/ Asus/ Hp/ Samsung/ Mi/ MacBook/ Ultrabook/ Thinkpad/ Ideapad/ Surfacepro Men Women (Blue)",549,4.2,"(1,597)","PERFECT SIZE & STORAGE SPACE: Laptop backpack with perfect size to hold things and your 15.6 inch laptop or 15 inch, 14 inch Laptop. Convenient main pockets for iPad, charger, binders, books, clothes, ect. Inside pockets keep your wallet, phone. bags for women / kids school bag / college bags for boys / laptop backpack
Front two slanted pocket perfect for quick finds such as your ID for work. keys for open door, two side pockets for water bottle and compact umbrella make your items organized. it can be use as school college bags for girls / backpack for men /backpacks for women . you can use it as a gift for men . bags for travelling
COMFY & STURDY: Made from WATER RESISTANT and DURABLE ECO-FRIENDLY nylon fabric with Two PADDED shoulder straps, relieve the stress of shoulder, simple but comfortable back design offer your great back support, making your working, journey and travelling more convenient wherever you go. you can use it such as office bag for men. office bag for women .
Light-weight Carrying and perfect for business traveling or trip, weekend getaways, back to school, outdoor activities and college bag for men etc;
MULTIPURPOSE & SIZE: 20 x 12.2 x 5.7 Inch, perfect to throw under your seat on an airplane when you are traveling or on business trip. Suitable for back to school college, can be easily stored. Good choose for a business laptop backpack, work backpack, laptop bag for men and women, also will be a good gifts for women, gifts for men, gifts for boyfriend or girlfriend and gift bag for travelers.
",B08Y3KCN32,,Tabelito
https://www.amazon.in/ADISA-Women-Girls-Floral-SL5072-CRE_Cream/dp/B09B56BCXR/ref=sr_1_74?crid=2M096C61O4MLT&keywords=bags&qid=1679388596&sprefix=ba%2Caps%2C283&sr=8-74,ADISA Women Girls Floral Print Sling Bag,495,4.2,"(1,208)","No of Compartments: 2
No of Pockets: 1
Closure: Magnetic
Dimensions: LxWxH - 7.25 x 3 x 5.75 inches
",B09B56BCXR,,ADISA
https://www.amazon.in/Safari-Groove-Water-Resistant-Backpack/dp/B09B27WXSF/ref=sr_1_75?crid=2M096C61O4MLT&keywords=bags&qid=1679388596&sprefix=ba%2Caps%2C283&sr=8-75,Safari Groove 35 Ltrs Water Resistant Backpack,899,3.7,(312),"100% Polyester, High Quality, Durable and Water Resistant Fabric
Front storage pocket keeps smaller items neatly organized and easy to access
Mesh pockets on both sides to accommodate your water bottle and umbrella
Mesh Padding on back & shoulder strap to provide comfort & better back support
1-year International Warranty against manufacturing defects
",B09B27WXSF,,Safari
https://www.amazon.in/Zipline-Nexa-Resistant-Bagpack-Backpack/dp/B08WQ668WJ/ref=sr_1_76?crid=2M096C61O4MLT&keywords=bags&qid=1679388596&sprefix=ba%2Caps%2C283&sr=8-76,Zipline Unisex Casual Polyester 36 L Backpack School Bag Women Men Boys Girls Children Daypack College Bag Book School Sports Bag,843,3.7,(739),"A super-slim backpack for men design, trendy looks and durable construction - this stylish 36 L backpack from ZIPLINE has got everything that will complement your youthful personality.This college bag has spacious interiors, this unisex backpack is a great option for short road trips, college and work. Ergonomic design of this school bag for boys are crafted from polyester, this medium school bag is sturdy enough to withstand regular wear and tear gracefully.
Zipline laptop bag for men features a cushioned base and internal back padding to offer you extra comfort. The padded shoulder straps of this school bag for boys can be easily adjusted according to your liking. Spacious backpack is featuring with four pockets and three main compartments all with speciality zippers, this office bag for men offers you enough space to carry your books, files, travel accessories, stationery, keys and mobile accessories. It comes with the ZIPLINE promise of quality.
The lighter your college Bag, the more you’ll enjoy hiking. With this in mind, we've ensured that the Zipline college bag weighs very light, and does not add extra weight to your back.
The Zipline school bag has been provided with a bouncy mesh that prevents sweatiness by allowing air flow. The padded back panel of this school bag and shoulder straps helps make carrying heavier loads easier and more comfortable.
Highly Durable and Water Resistant fabric have been used in this school bag for boys
",B08WQ668WJ,"A super-slim design, trendy looks and durable construction - this stylish 36 L backpack from ZIPLINE has got everything that will complement your youthful personality. With its spacious interiors, this unisex backpack is a great option for short road trips, college and work. Ergonomic design Crafted from polyester, this medium backpack is sturdy enough to withstand regular wear and tear gracefully. It features a cushioned base and internal back padding to offer you extra comfort. The padded shoulder straps of this bag can be easily adjusted according to your liking. Spacious Featuring one front pocket and three main compartments, all with speciality zippers, this bag offers you enough space to carry your books, files, coins, travel accessories, stationery, keys and mobile accessories. It comes with the ZIPLINE promise of quality.Product Description",Zipline
https://www.amazon.in/FUR-JADEN-Waterproof-Charging-BM25_Grey/dp/B07FM9BSKW/ref=sr_1_77?crid=2M096C61O4MLT&keywords=bags&qid=1679388596&sprefix=ba%2Caps%2C283&sr=8-77,FUR JADEN 15.6 Anti Theft Laptop Backpack with USB Charging Port Unisex Bag for College Office Suitable for Men Women,789,4.0,"(5,804)","KEY FEATURES - Grey Colour Laptop Backpack for Men and Women for Stylish Office use as well as for Trendy College students. Huge compartment size that can fit upto a 15.6 inch Laptop with ease. Multiple pockets for other accessories.
Charging On the Go - Now charge your phone on the go while travelling without the hassle of holding the bulky power bank in your pocket or in your hand. Simple Connect your Powerbank to the wire inside the Bag and leave it in the bag. When you want to charge your phone, just connect your phone charger to the bag and your phone will start charging. IMPORTANT NOTE: We do NOT provide Free Portable Charger with the Bag
Anti Theft Design - This backpack by Fur Jaden has anti theft design where zipper of the main pocket is hidden at the back. No thief, intruder or robber can find a way to open the backpack, making this totally theft proof. There are secret pockets on the shoulder strap and on the sides of the bag allowing us to keep travel documents, boarding pass, credit cards, mobile phone, earphones etc.
Essence of Fur Jaden - We craft signature Laptop Backpacks and Casual Backpacks that are young, vibrant and fashionable, and yet a celebration of timeless style, luxe and sophistication. We strive to make thoughtful designs that are high on aesthetics as well as on utility and functionality.
WARRANTY- 6 Month Manufacturer Warranty. 100% Genuine Fur Jaden Men products, 10 days No Question asked replacement guarantee from the date of delivery.
",B07FM9BSKW,,FUR JADEN
https://www.amazon.in/BennettTM-Shoulder-Messenger-Repellent-Charcoal/dp/B09CV24TMK/ref=sr_1_78?crid=2M096C61O4MLT&keywords=bags&qid=1679388596&sprefix=ba%2Caps%2C283&sr=8-78,Bennett™ Mystic Unisex Adult Men's Laptop Bag 15.6 inch Side Shoulder Briefcase Satchel Messenger Business Bags for Men & Women Front Pocket for Laptop Accessories - Black (6 Month Warranty),512,4.1,"(5,212)","PREMIUM QUALITY MATERIAL: This laptop computer briefcase is made of high-quality water repellent fabric, and well-made of foam pad inside. The laptop briefcase equipped with a removable shoulder strap and a soft carry handle, you can easily switch the carry way you want.
LIGHTWEIGHT AND MULTIFUNCTIONAL: It provide a removable shoulder strap, can be use as shoulder bag or handbag base on your need; top handle strap, and comes with adjustable strap with. It will be a good partner for your daily use or business trip.
EXCELLENT DETAILS: The laptop bag with exquisite zippers, durable hook of strap and soft handle, which make it more comfortable to carry and use. Ensure a secure and long-lasting usage everyday as office work bag, travel laptop briefcase, business laptop case, college laptop bag.
DIMENSION: External: 16 x 12 x 3 inch; Dimension: 16.5 x 11.5 x 2.5 inch. Suitable for 14-15.6 inch: Dell, Acer, ASUS, Samsung, HP and other brand laptops.(Please allow a little size different because of manual measurement). Great gifts choice for birthday, work anniversary.
BENNETT Warranty: Exchange within (6 months) if you don't like. If any problems, please do not hesitate to contact us. We will provide the best solution for you.
",B09CV24TMK,,
https://www.amazon.in/YuvKuz-TM-Infocus-Digitizer-Assembly/dp/B07MXNWTB2/ref=sr_1_79?crid=2M096C61O4MLT&keywords=bags&qid=1679388596&sprefix=ba%2Caps%2C283&sr=8-79,Lavie Women's Nova Tote Bag | Ladies Purse Handbag,989,4.2,"(7,453)","Lavie Malnov tote is a stylish offering for ladies. It is durable, light weight and super spacious. Made from vegan leather, this large hand bag comes in Herringbone, Woven and Croco texture pattern at the front.
Woven Texture- 45 cm in length x 12 cm in width x 35 cm in height
Malnov hand bag has a top zip closure for safety and comfort. The interior has 2 slip pockets along with 1 zip pocket providing plenty of storage space for keeping phone, portable charger, keys, hairbrush, wallet, sunglasses, sanitizer and a pair of clothes.
This latest tote is perfect for women to carry for a weekend getaway or even a day at the mall for shopping. It can be paired with formal pants & blazer as well as with a basic crop top and jeans. This spacious and sturdy bag makes for a perfect gift for all your occasions.
The bag has a well stitched inner lining and high quality zippers for easy accessibility and storage.
",B07MXNWTB2,This trendy Red tote from Lavie is an absolute necessity. It has a woven pattern for a twigged Indian appeal. Fuse it with your favourite denims and heels.,Lavie
https://www.amazon.in/HEROZ-Backpack-Resistant-Computer-17-3-inch/dp/B083N3DCTM/ref=sr_1_80?crid=2M096C61O4MLT&keywords=bags&qid=1679388596&sprefix=ba%2Caps%2C283&sr=8-80,HEROZ Hacker 50 litres Nylon Travel Laptop Backpack Water Resistant Slim Durable Computer Book Bag Tracking Fits Up to 17.3-inch Laptop (058- ALL) (Navy Blue),"1,439",4.1,"(3,717)","Material: Nylon, Inner Material: Polyester, Capacity: 50 Liters, Color: Grey & Navy Blue, Special Features: Back Padding, Chest Strap, Earphone Cord Support, Hip Belt, Integrated Rain Cover, Laptop Compartment, Telescope Handle, Water Bottle / Umbrella Pouch, Zip Closure, Padded Handles, Shoulder Strap<br> <br>
Age Range Description: Adult; Style Name: Country; Pattern Name: Solid; Strap Type: Cross-Body; Closure Type: Zipper; Pocket Description: Utility Pocket <br>
",B083N3DCTM,,
https://www.amazon.in/sspa/click?ie=UTF8&spc=MToxMjcxMDIwNzc1ODM4MzYzOjE2NzkzODg2ODU6c3BfYXRmX25leHQ6MjAxMjE0ODk2Mzg0OTg6OjA6Og&url=%2FLOOKMUSTER-Waterproof-Backpack-College-Business%2Fdp%2FB0BS6YGKMC%2Fref%3Dsr_1_81_sspa%3Fcrid%3D2M096C61O4MLT%26keywords%3Dbags%26qid%3D1679388685%26sprefix%3Dba%252Caps%252C283%26sr%3D8-81-spons%26sp_csd%3Dd2lkZ2V0TmFtZT1zcF9hdGZfbmV4dA%26psc%3D1,LOOKMUSTER Casual Waterproof Laptop Backpack/Office Bag/School Bag/College Bag/Business Bag/Travel Backpack,528,5.0,(2),"Care Instructions: Dry Clean Only
30L Capacity: The Backpack has a padded laptop compartment that can fit 15.6 inch laptop. It can also accommodate essentials such as a Lunch box, Charger, Tablet, Books, Power Bank, Wallet, and Sunglass.
Multi-Level Organizer: The backpack has a front zipper pocket for the ID card, Sanitizer, House keys, Pen. First compartment with pockets for the earphones, pens, notebook, Fitness Band. Spacious second compartment for all your electronics. Compatible Laptop Size 16 inch
Ergonomic Design: Thick cushioning around the shoulders and on the back panel makes the backpack super light and comfortable on the move. “S” Shaped shoulder strap distribute the weight of the backpack across your upper body.
Made In India: Lookmuster Business Casual Backpack is fully manufactured in India and pass through stringent quality tests and checks
Water Resistant Material: Advanced IPX4 coating on the material ensures resistance to water entering from any direction.
",B0BS6YGKMC,,
https://www.amazon.in/sspa/click?ie=UTF8&spc=MToxMjcxMDIwNzc1ODM4MzYzOjE2NzkzODg2ODU6c3BfYXRmX25leHQ6MjAxMjQzMTEwMjQ4OTg6OjA6Og&url=%2Fuppercase-Backpack-2300EBP1-resistant-sustainable%2Fdp%2FB0BWNCV31F%2Fref%3Dsr_1_82_sspa%3Fcrid%3D2M096C61O4MLT%26keywords%3Dbags%26qid%3D1679388685%26sprefix%3Dba%252Caps%252C283%26sr%3D8-82-spons%26sp_csd%3Dd2lkZ2V0TmFtZT1zcF9hdGZfbmV4dA%26psc%3D1,"uppercase Medium 17 Ltrs Vegan Leather (upto 14 inch) Laptop Backpack 2300EBP1 3x more water resistant sustainable bags with rain proof zippers for Men, Women, Boys and Girls, 750 Days warranty","1,600",4.0,(373),"Care Instructions: Wipe with Damp Cloth
Handcrafted with care and made up of premium quality robust material
Wrinkle free bag and 3x more water resistant with Rainproof zippers; Trolley sleeve to securely place the bags on the luggage
Right sized with sturdy stitching; Dimension: (28.2 cm x 14.1 cm x 42.2 cm); Warranty: 750 days international warranty
GRS certified for sustainability; The GRS (Global Recycled Standard) is intended for use with any product that contains at least 50% Recycled Material (License No. CMPY-158596)
Padded laptop compartment fits up to 14”, Back padding with Air mesh; Front access pocket for you to easily carry important small items with two bottle holders on the sides
",B0BWNCV31F,,uppercase
https://www.amazon.in/Half-Moon-Trekking-Bags-Compartment/dp/B08PSX1LN9/ref=sr_1_83?crid=2M096C61O4MLT&keywords=bags&qid=1679388685&sprefix=ba%2Caps%2C283&sr=8-83,Half Moon 45L Hammer Waterproof Laptop Travelling Rucksack Trekking Backpack for Travel Journey bags for Men Women Boys & Girls with 17.3inch Laptop Compartment & Rain cover,"1,299",4.1,"(1,013)","SPECIAL FEATURES : Back Padding, Chest Strap, Earphone Cord Support, Unique Design, Hip Belt, Integrated Rain Cover, Laptop Compartment, Telescope Handle, Water Bottle / Umbrella Pouch, Zip Closure, Padded Handles, Padded Shoulder Strap , Breathable Mesh etc.<br>; Closure Type: Zipper; Age Range Description: Adult; Color Name: Navy Blue<br>; Closure Type: Zipper; Age Range Description: Adult<br><br> <br>
Compartment Description: Up To 17 Inches<br><br> <br>
Pattern Name: Solid <br>
",B08PSX1LN9,"This Rucksack backpack ensures complete safety to your 17.3 inch laptop with high quality build and a wide range of built-in features, With a Dual Side Pocket In the inside of the bag, featuring protective padding, you can rest assured that the laptop inside it will be well cushioned from any accidents caused when you bump into any surface. As it is made of nylon, can withstand abrasions and is long lasting. Chest Strap, Hip Belt, Straight Shaped Straps structure which fits on your shoulders very comfortably makes you lift heavy objects easily. A Front Pocket with an Organizer helps you store your small essentials. It also features Reflector Logo, Rain cover and Reflector patch which is highly useful for motorists, cyclists, walking at night. It also features an Earphone Cord Support which very useful for long travelers. The inner material is made of polyester. This backpack is also water-resistant.",Half Moon
https://www.amazon.in/Safari-Casual-Backpack-Charging-Resistant/dp/B09B2581S9/ref=sr_1_84?crid=2M096C61O4MLT&keywords=bags&qid=1679388685&sprefix=ba%2Caps%2C283&sr=8-84,"Safari Sneak Casual Backpack with USB Charging Port 26 Ltrs Water Resistant Fabric - Grey, L (SNEAK19CBGRE)",949,3.7,(822),"100% Polyester, High Quality, Durable and Water Resistant Fabric
Front storage pocket keeps smaller items neatly organized and easy to access
Mesh pockets on both sides to accommodate your water bottle and umbrella
USB Charging Point to Charge On the Go - With our attached charging dock, now charing on the go is easier than before. Important Note: We do not provide Free Portable Charger with the Bag; 1-year International Warranty against manufacturing defects
Special Features: Lightweight; Closure Type: Zipper; Age Range Description: Adult
",B09B2581S9,"Safari Sneak is a 26 Litres, 2 compartment USB backpack perfect for daily usage. Built in USB charging port outside and built in charging cable inside, perfect for working professionals and college goers. This backpack is especially designed for todays fast paced world, where everything should be compact and lightweight. This backpack is perfect for everyday usage such as office, college, school, tuitions, or short holiday trips. The front pocket is designed to keep your essentials organized and side mesh pockets are perfect for storing your water bottle and umberella. Made of high grade water resistant polyester fabric, this backpack will last you several trips.",Safari
https://www.amazon.in/Li-Ning-Panther-Double-Polyester-Badminton/dp/B09VDQDXWN/ref=sr_1_85?crid=2M096C61O4MLT&keywords=bags&qid=1679388685&sprefix=ba%2Caps%2C283&sr=8-85,Li-Ning Panther Double Zipper Polyester Badminton Kit Bag,999,4.3,(314),"Comfy & Sturdy - Li-Ning Panther Kit Bag is not only stylish in looks but also features comfortable straps and sturdy buckles.
Finesse - This bag is crafted with premium lightweight tear-resistant fabric and high-grade polyester for a superior finish.
Soft and Comfortable Padding - Comfortable soft padded design with thick but soft multi-panel ventilated padding gives you maximum support.
Dynamic Zippers - The Li-Ning Panther KitBag is equipped with dynamic zippers that have easy open and close functionality and are sturdily built.
Easy to carry - The Li-Ning Panther Kitbag comes with rounded stitched grip handles that give you the option of easy mobility.
",B09VDQDXWN,"The Li-Ning Panther Badminton Kit Bag comes with 2 spacious compartments for all the gear you need to be on your path to glory! It is made with premium quality polyester material. It features cushioned & insulated compartments, a dedicated shoe compartment, and an adjustable shoulder strap making it an all-rounded dynamic bag.",Li-Ning
https://www.amazon.in/Motherly-Stylish-Babies-Diaper-Mothers/dp/B07DMKJJB4/ref=sr_1_86?crid=2M096C61O4MLT&keywords=bags&qid=1679388685&sprefix=ba%2Caps%2C283&sr=8-86,motherly 25 ltrs (25 Cms) backpack(5860_grey),"1,736",4.5,"(5,477)","The bag measures: 39.5 cm x 26 cm x 20 cm, Weighs: 700 gm
",B07DMKJJB4,,motherly
https://www.amazon.in/Resistant-Duffle-Shoulder-Separate-Compartment/dp/B09KVBSG61/ref=sr_1_87?crid=2M096C61O4MLT&keywords=bags&qid=1679388685&sprefix=ba%2Caps%2C283&sr=8-87,"Wooum Gym Bag Sport Outdoor Bag, Shoulder Bag Side Bag with Separate Shoes Compartment Water Resistance - Dark Grey",397,4.2,(466),"Product Size - 16.5 x 9 x 9 Inches or 42x23x23 cm
",B09KVBSG61,,Wooum
https://www.amazon.in/Half-Moon-Waterproof-Laptop-Backpack/dp/B09QM9N1B3/ref=sr_1_88?crid=2M096C61O4MLT&keywords=bags&qid=1679388685&sprefix=ba%2Caps%2C283&sr=8-88,Half Moon 30L Waterproof 15.6 inch Laptop Office School College Bag Backpack for Men Women Boys & Girls,589,3.6,(361),"SPACIOUS AND LIGHTWEIGHT: Light weight and spacious laptop backpack with 3 compartments. One compartment is for carrying laptop inside (Upto 17 inches), with padding for safety, and space for laptop accessories like charger, etc. Second large compartment for books, files and all your day to day essentials. And third compartment is for your extra stuff. It has provision for holding bottles on both sides and has padded shoulder straps for your comfort<br>
COMFORT WITH QUALITY: This casual bag has Wide, Padded and Adjustable shoulder straps and Padded Back for comfort in carrying heavy items. Stitched properly and Bartacks on every pressure point for extra durability. Made with strong yet light weight polyester fabric with heavy zippers. Serves the need of a professional office laptop bag, college bag, student backpack, school bag and is suitable for all, i.e. boys, girls, men? and women?<br>
PREMIUM FABRIC : Premium Polyester, Stylish and durable backpack for school /college and travel. Easily accommodate a laptop. Size: 45 cm X 31 cm X 22 cm; INTERNAL ORGANISER: This backpack features an Internal Organiser that is small pockets inside the front compartment for holding pens, ID cards, etc. These pockets are very useful in organizing your small day-to-day items.<br>
OTHER FEATURES: Strong and durable zippers, Adjustable Shoulder Handles (Straps) , 2 Bottle/Umbrella holders , Padded Handle , Padded Laptop Compartment , Ergonomic Design, Reflector Logo, etc<br>
Water Resistance Level: Water Resistant; Pocket Description: Utility Pocket; Pattern Name: Solid; Age Range Description: Adult; Compartment Description: Up To 17 Inches<br>
",B09QM9N1B3,"FEATURES: DURABLE MATERIAL: Made with strong polyester fabric with heavy zippers. Serves the need of a professional office laptop bag, college bag, student backpack, school bag and is suitable for all, i.e. boys, girls, men and women; COMFY & STURDY: Its padded, adjustable shoulder straps do not put pressure on the shoulders. Foamed padded top handle is easy on your palm and fingers; DURABLE AND LIGHT WEIGHT MATERIAL: Made with strong yet light weight polyester fabric with heavy zippers; INTERNAL ORGANISER: This backpack features an Internal Organiser that is small pockets inside the front compartment for holding pens, ID cards, etc. These pockets are very useful in organizing your small day-to-day items; LOTS OF STORAGE SPACE & POCKETS: One separate Padded laptop compartment. Multiple compartments can store lots of stuff, that too organised.",Half Moon
https://www.amazon.in/Nivia-Deflate-5180BK-Polyester-Round/dp/B07222KX3S/ref=sr_1_89?crid=2M096C61O4MLT&keywords=bags&qid=1679388685&sprefix=ba%2Caps%2C283&sr=8-89,NIVIA Deflate Round 01 Polyester Gym Bag/Unisex Gym Bags/Adjustable Shoulder Bag for Men/Duffle Gym Bags for Men/Carry Gym Accessories/Fitness Bag/Sports &Travel Bag/Gym kit Bag,449,4.2,"(7,268)","Strong stitching at major stress points provide long-lasting durability against daily activities. Main compartment with zip closure
Durable zippers and enhanced by strong stitching at major stress points
Lightweight and fold-able, It's easy to fold up into small compact space.
Water-resistant finish to save inner items from water splashes .
Optimum quality of accessories and zipper for smoother functioning and high durability
",B07222KX3S,,Nivia
