url,name,price,rating,number_of_rating,description,asin,product_description,manufacturer
https://www.amazon.in/American-Tourister-AMT-SCH-02/dp/B07CJCGM1M/ref=sr_1_1?crid=2M096C61O4MLT&keywords=bags&qid=1679388204&sprefix=ba%2Caps%2C283&sr=8-1,American Tourister 32 Ltrs Black Casual Backpack (AMT FIZZ SCH BAG 02 - BLACK),"1,199",4.1,"(52,288)","Laptop Compatibility: No, Strap Type: Adjustable, Trolley Support: No. With Rain Cover : No
Outer Material: Polyester, Color: Black
Water Resistance: Water resistant , not Waterproof
Capacity: 32 liters; Dimensions: 31.5 x 22 x 49.5 Centimeters
Number of Wheels: 0, Number of compartments: 3
Warranty type: Manufacturer; 1 year International warranty valid for 1 year from the original date of
Mesh pockets on both sides to accommodate your sipper or bottle and umbrella
Mesh Padding on back & shoulder strap to provide comfort & better back support
",B07CJCGM1M,,American Tourister
https://www.amazon.in/Skybags-Brat-Black-Casual-Backpack/dp/B08Z1HHHTD/ref=sr_1_2?crid=2M096C61O4MLT&keywords=bags&qid=1679388204&sprefix=ba%2Caps%2C283&sr=8-2,Skybags Brat Black 46 Cms Casual Backpack,659,4.1,"(3,770)","Combination of functional & safety features in stylish design, Soft mesh back with 8 mm foam padded 2 Main Compartment, 1 Slip In Pocket inside the bag, Printed Design, Mesh bottle holder on the side,
",B08Z1HHHTD,"Ideal for a college student who does not carry a lot of books or laptop to college. Very stylish, slim and feature loaded Backpack",Skybags
https://www.amazon.in/Wesley-Milestone-Waterproof-Backpack-Business/dp/B084JGJ8PF/ref=sr_1_3?crid=2M096C61O4MLT&keywords=bags&qid=1679388204&sprefix=ba%2Caps%2C283&sr=8-3,Wesley Milestone 2.0 Casual Waterproof Laptop Backpack/Office Bag/School Bag/College Bag/Business Bag/Travel Backpack (Dimensions:13x18 inches) (Compatible with 39.62cm(15.6inch laptop) 30 L (Blue & black),565,4.3,"(9,794)","30L Capacity: The Backpack has a padded laptop compartment that can fit 15.6 inch laptop. It can also accommodate essentials such as a Lunch box, Charger, Tablet, Books, Power Bank, Wallet, and Sunglass.
Multi-Level Organizer: The backpack has a front zipper pocket for the ID card, Sanitizer, House keys, Pen. First compartment with pockets for the earphones, pens, notebook, Fitness Band. Spacious second compartment for all your electronics.
Ergonomic Design: Thick cushioning around the shoulders and on the back panel makes the backpack super light and comfortable on the move. “S” Shaped shoulder strap distribute the weight of the backpack across your upper body.
Made In India: Wesley Business Casual Backpack is fully manufactured in India and pass through stringent quality tests and checks
1 Year Warranty: The Wesley Business casual backpack comes with 1 year of warranty
Water Resistant Material: Advanced IPX4 coating on the material ensures resistance to water entering from any direction.
",B084JGJ8PF,,Wesley
https://www.amazon.in/Lavie-Sport-Duffle-Luggage-Trolley/dp/B097RJ22Q3/ref=sr_1_4?crid=2M096C61O4MLT&keywords=bags&qid=1679388204&sprefix=ba%2Caps%2C283&sr=8-4,Lavie Sport Lino Large Size 63 cms Wheel Duffle Bag for Travel | Travel Bag with Trolley,949,3.9,"(6,297)","The Lino wheel Duffle Bag from Lavie Sport is a voluminous yet lightweight travel duffle. Made of high quality and durable materials, it provides the same function as a large-sized suitcase.Perfect travel duffle for weekend getaways.
Built to last: This duffle bag for travel features a combi-lock, shoulder strap, fully lined interior and is built with high-quality polyester fabric for the utmost durability. Made from water repellent & premium zippers, it makes it a super durable and lightweight all-weather travel duffle bag.
Plenty of Space & Easy to carry: The front side features a zippered pocket that is perfect to store quick access essentials. Lino luggage bags for travel have sturdy heavy-duty treaded rubber wheels in a protective wheel housing and retractable trolley for smooth mobility and maximum durability.
External Dimension: Length – 63cm, Width – 30cm, Height – 32cm, Capacity - 60 Litres.
Manufacturer warranty - 2 years
",B097RJ22Q3,This unisex stylish travel Bag is made of premium nylon fabric which is the most durable material. It is water and scratch resistant. It has a full lining made of polyester for additional strength and protection for your valuables.,Lavie Sport
https://www.amazon.in/ADISA-Laptop-Backpack-Office-College/dp/B09TPX22NF/ref=sr_1_5?crid=2M096C61O4MLT&keywords=bags&qid=1679388204&sprefix=ba%2Caps%2C283&sr=8-5,ADISA 15.6 inch Laptop Backpack Office Bag College Travel Back Pack 32 Ltrs (z-Navy Blue),499,3.8,(566),"Material: Water Resistant Light-Weight Polyester<br>
Compartments: 2 with padding; Laptop Size: 15.6 inch and below<br>
Dimensions: LxWxH - 12.5 x 7.5 x 19 inches<br>
Reflector Logo / Adjustable Padded Shoulder Straps / 2 Bottle holders<br>
Closure Type: Zipper<br>
",B09TPX22NF,,ADISA
https://www.amazon.in/Half-Moon-Waterproof-Backpack-Students/dp/B085MHDJ93/ref=sr_1_6?crid=2M096C61O4MLT&keywords=bags&qid=1679388204&sprefix=ba%2Caps%2C283&sr=8-6,Half Moon 35 L Waterproof Laptop College School Office Bag Backpack for Men Women Boys Girls with 15.6 inch Padded Laptop Compartment & Rain Cover (Navy_Blue),689,3.9,"(15,248)","SPACIOUS AND LIGHTWEIGHT: Light weight and spacious laptop backpack with 3 compartments. One compartment is for carrying laptop inside (Upto 17 inches), with padding for safety, and space for laptop accessories like charger, etc. Second large compartment for books, files and all your day to day essentials. And third compartment is for your extra stuff. It has provision for holding bottles on both sides and has padded shoulder straps for your comfort
COMFORT WITH QUALITY: This casual bag has Wide, Padded and Adjustable shoulder straps and Padded Back for comfort in carrying heavy items. Stitched properly and Bartacks on every pressure point for extra durability. Made with strong yet light weight polyester fabric with heavy zippers. Serves the need of a professional office laptop bag, college bag, student backpack, school bag and is suitable for all, i.e. boys, girls, men and women
PREMIUM FABRIC : Premium Polyester, Stylish and durable backpack for school /college and travel. Easily accommodate a laptop. Size: 45 cm X 31 cm X 22 cm
BACK SUPPORT: We have designed the bag keeping your comfort in mind. Shoulder has high density padding, with 3D ventilated air foam padding to prevent sweating when you use the bag & to help you lift heavy objects easily.
OTHER FEATURES: Strong and durable zippers, Adjustable Shoulder Handles (Straps) , 2 Bottle/Umbrella holders , Padded Handle , Padded Laptop Compartment (can carry laptops of size 13, 14, 15.6 & 17 inches), Reflector Logo.
",B085MHDJ93,,Half Moon
https://www.amazon.in/GEAR-Black-Blue-Backpack-years/dp/B019HA8AYG/ref=sr_1_7?crid=2M096C61O4MLT&keywords=bags&qid=1679388204&sprefix=ba%2Caps%2C283&sr=8-7,Gear CarryOn 16L Foldable Water Resistant School Bag//Backpack/College Bag for Men/Women - Blue Black,214,3.7,"(6,056)","Outer Material: Polyester, Color: Black and Yellow.Ideal for 3-5 year old children.
Wear Resistant: Wear resistant, Stain resistant, Water Resistance: Water resistant; Dimensions: 49 cms x 33 cms x 10 cms (LxWxH)
Number of compartments: 1; Compatible Laptop Size : 15.4
Warranty Type: Manufacturer; 1 Year from the date of purchase
Pocket Description: Utility Pocket; Color Name: Black And Blue; Age Range Description: Adult; Closure Type: Zipper
",B019HA8AYG,"Intuitively crafted at the Gear design studio to balance comfort, style, endurance and functionality.",Gear
https://www.amazon.in/SAFARI-Ltrs-Casual-Backpack-DAYPACKNEO15CBSEB/dp/B07Q7CNPMV/ref=sr_1_8?crid=2M096C61O4MLT&keywords=bags&qid=1679388204&sprefix=ba%2Caps%2C283&sr=8-8,SAFARI 15 Ltrs Sea Blue Casual/School/College Backpack (DAYPACKNEO15CBSEB),299,4.0,"(18,009)","Outer Material: Polyester, Color: Sea Blue
Not water resistant. With Rain Cover:No
Capacity: 15 liters; Weight: 200 grams; Dimensions: 12 cms x 27 cms x 41 cms (LxWxH)
Number of compartments: 2; Laptop Compatibility: No
Age Range Description: Kid; Closure Type: Drawstring; Pocket Description: Utility Pocket
Drawstring, 2 Compartments, Compact Size
",B07Q7CNPMV,"Be it your short trips or your daily travel across the city, daypack has got you covered. With a 15 litre capacity daypack lets you carry your wallet, umbrella, kerchief, keys, earphones, Notepad, pens and other Essentials. The drawstring compartment lets you dump things that you pick up on your way. Compact Size and 2 Compartment.",Safari
https://www.amazon.in/Half-Moon-Spacious-Backpack-Compartment/dp/B0BLVQ9NTD/ref=sr_1_9?crid=2M096C61O4MLT&keywords=bags&qid=1679388204&sprefix=ba%2Caps%2C283&sr=8-9,Half Moon Strike 35L Unisex Spacious School/Laptop/College/Office Travel Backpack Bag for Men Women Boys & Girls with 15.6 inch Padded Laptop Compartment & Multiple Pockets,699,3.7,(115),"MULTI-FUNCTION COMPARTMENT: HALF MOON backpack features multiple storage compartments and features for additional supplies and accessories as your, iPhone, iPad, pen, keys, wallet, books, clothes, bottle, passport and more. <br>
DURABLE MATERIAL: Superior quality durable ECO Friendly waterproof and anti-scratch polyester and featuring a reinforced bottom to withstand heavy use, perfect for business, travel, school and other outdoor activities <br>
COMFORTABLE DESIGN: Our backpack's ""S"" Curve adjustable, heavily padded shoulder straps and back panel make the backpack comfortable to wear even when loaded with all your gear; Compact:Backpack has a roomy Three compartment, front zipper pockets to hold small accessories, one internal security zippered pocket for valuable items and side pockets for water bottle or umbrella. <br>
Size:18*13*10 inch(L*W*H), Capacity: 35L which is bigger than others of the same style. Good size for school, camping, travel, shopping, hiking, climbing, vintage backpack for men and women.; OTHER FEATURES: Laptop compartment, Internal Organiser(Small Pockets), Strong and durable zippers, Adjustable Shoulder Handles (Straps) , 2 Bottle/Umbrella holders , Padded Handle , Padded Laptop Compartment , Ergonomic Design, Reflector Logo, etc <br>
Age Range Description: Kid; Pocket Description: Utility Pocket; Special Features: Water Resistant; Pattern Name: Solid; Water Resistance Level: Water Resistant <br>
",B0BLVQ9NTD,"A super-slim design, trendy looks and durable construction - this stylish 35 L backpack from Half Moon has got everything that will complement your youthful personality. With its spacious interiors, this unisex backpack is a great option for short road trips, college and work. Ergonomic design Crafted from polyester, this medium backpack is sturdy enough to withstand regular wear and tear gracefully. It features a cushioned base and internal back padding to offer you extra comfort. The padded shoulder straps of this bag can be easily adjusted according to your liking. Spacious Featuring one front pocket and three main compartments, all with speciality zippers, this bag offers you enough space to carry your books, files, coins, travel accessories, stationery, keys and mobile accessories. It comes with the Half Moon promise of quality.",Half Moon
https://www.amazon.in/American-Tourister-BACKPACK-COMPARTMENT-ORGANIZER/dp/B0BTD4FK9G/ref=sr_1_10?crid=2M096C61O4MLT&keywords=bags&qid=1679388204&sprefix=ba%2Caps%2C283&sr=8-10,"American Tourister VALEX BLUE LAPTOP BACKPACK 28 Ltrs,Volume, LAPTOP COMPARTMENT, BOTTLE POCKET, FRONT ORGANIZER","1,299",4.1,(8),"Care Instructions: Hand Wash Only
Well Organized compartment ,Security Back Pocket
",B0BTD4FK9G,"A backpack isn’t just a bag. It’s a cache, a case, a mobile base of sorts. And it is a reflection of the care you’ve put into selecting the ideal loadout of items to keep on you. Introducing Valex, a modern everyday backpacks collections are available in a variety of nice looking colours to express your true self",American Tourister
https://www.amazon.in/Half-Moon-Backpack-Compartment-Reflective/dp/B0BJ32LQ6X/ref=sr_1_11?crid=2M096C61O4MLT&keywords=bags&qid=1679388204&sprefix=ba%2Caps%2C283&sr=8-11,Half Moon Large 37L Laptop Bag Backpack for menं Women Boys and Girls Luggage Travel Bags with 17.3 inches Laptop Compartment & Rain Cover,849,3.9,"(2,340)","SPACIOUS AND LIGHTWEIGHT: Light weight and spacious laptop backpack with 3 compartments. One compartment is for carrying laptop inside (Upto 17 inches), with padding for safety, and space for laptop accessories like charger, etc. Second large compartment for books, files and all your day to day essentials. And third compartment is for your extra stuff. It has provision for holding bottles on both sides and has padded shoulder straps for your comfort <br>
COMFORT WITH QUALITY: This Backpack has Wide, Padded and Adjustable shoulder straps and Padded Back for comfort in carrying heavy items. Stitched properly and Bartacks on every pressure point for extra durability. Made with strong yet light weight polyester fabric with heavy zippers. It also comes with a Rain cover so that you can travel during rainy season without any problem. This backpack be used by everyone be it men? , women? , boys , girls. <br>
SMART & TRENDY LOOKS: This Large rucksack bag is smart, trendy and stylish in looks. The multipurpose rucksack bacpack looks smart, athletic and venturesome and the blend of grey and red makes it appear exquisite. Your hiking trips, mountaineering experience cannot get completed without this amazing trekking backpack. <br>
ENDURING & LONG LASTING: This trekking backpack bag is made up of highly durable material, which makes it suitable for all weather conditions including heavy rains and extreme scorching heat. It will not only keep the inside stuff safe but will also resist damage to itself.;Age Range Description: Adult; Pocket Description: Utility Pocket; Style Name: Casual <br>
OTHER FEATURES: Rain Cover, 17 inch Laptop compartment, Internal Organiser(Small Pockets), Strong and durable zippers, Adjustable Shoulder Handles (Straps) , 2 Bottle/Umbrella holders , Padded Handle , Padded Laptop Compartment , Ergonomic Design, Reflector Logo, etc <br>
",B0BJ32LQ6X,"This backpack is lightweight water-resistant, capacity of approx 37 Ltr, has a soft and ventilated back panel, and is perfect for carrying all your necessities. Adjustable and breathable padded shoulder strap to meet different requirements for both men and women; made from highly rip and water-resistant polyester fabric, provide strengthen and long-lasting performance; roomy enough for your traveling requirements also having a Rain cover.",Half Moon
https://www.amazon.in/Backpack-Small-Black-Water-Repellant/dp/B088XB5XY8/ref=sr_1_12?crid=2M096C61O4MLT&keywords=bags&qid=1679388204&sprefix=ba%2Caps%2C283&sr=8-12,"Mi Step Out 12 L Mini Backpack (Small Size, Black, Water Repellant)",398,4.1,"(8,155)","Made of multi-coated 600D polyester Material ; Water Repellent
Dimension: 26cm x 38cm x 14cm (LxWxH); Weight : 200 grams; Capacity: 12liters
Small Size backpack; Laptop Compatibility: No
This backpack comes with 2 zipper pockets that can house a notebook, gym gear, travel essentials and more
With contra zippers and adjustable straps this light weight backpack is the ideal companion while at the airport or hitting the gym or exploring new city or using it as a carrier for books
6 months limited warranty
",B088XB5XY8,,MI
https://www.amazon.in/Gear-Classic-Leather-Backpack-LBPCLSLTH0201/dp/B07G4F6XFH/ref=sr_1_13?crid=2M096C61O4MLT&keywords=bags&qid=1679388204&sprefix=ba%2Caps%2C283&sr=8-13,Gear Classic 20L Faux Leather Water Resistant Anti Theft Laptop Bag/Backpack for Men/Women-Brown,"1,075",4.4,"(5,454)","Outer material: synthetic, color: brown
Waterproof
Capacity: 20 liters; Weight: 560 grams; Dimensions: 48 cms x 32 cms x 14 cms (LxWxH)
Number of compartments: 2
Laptop compatibility: yes, laptop size: 16strap type: adjustable
Anti theft waterproof bag with anti sweat fabric on back and shoulder straps
USB and headphone cable slot
",B07G4F6XFH,"Gear bags are designed for the quick commute as well for the long journey. these backpacks can be used as laptop bags,adventure bags and so on. Your favorite travel companion, The backpacks come with enough storage space to carry all your requirements.",Gear
https://www.amazon.in/Safari-Laptop-Backpack-Resistant-Fabric/dp/B09B25Z8M2/ref=sr_1_14?crid=2M096C61O4MLT&keywords=bags&qid=1679388204&sprefix=ba%2Caps%2C283&sr=8-14,"Safari Quill Laptop Backpack 26 Ltrs Water Resistant Fabric - Black, L (QUILL19CBBLK)",799,3.9,(715),"100% Polyester, High Quality, Durable and Water Resistant Fabric
2 compartment backpack with a padded sleeve for laptops, can hold upto 17 inch laptop/notebook
Front storage pocket keeps smaller items neatly organized and easy to access
Mesh Padding on back & shoulder strap to provide comfort & better back support; 1-year International Warranty against manufacturing defects
Age Range Description: Adult; Closure Type: Zipper; Special Features: Lightweight
",B09B25Z8M2,"Safari Quill is a 26 Litres, 2 compartment laptop backpack perfect for daily usage. It has a dedicated tech safe laptop sleeve that can hold upto 17 inch laptop or any smaller ones easily. The laptop sleeve is also fully padded from the bottom protecting your device from any shock or damage. This backpack is especially designed for todays fast paced world, where everything should be compact and lightweight. This backpack is perfect for everyday usage such as college, school, tuitions, or short holiday trips. The front pocket is designed to keep your essentials organized and side mesh pockets are perfect for storing your water bottle and umberella. Made of high grade water resistant polyester fabric, this backpack will last you several trips.",Safari
https://www.amazon.in/ADISA-BP005-Weight-Casual-Backpack/dp/B07F3X45WZ/ref=sr_1_15?crid=2M096C61O4MLT&keywords=bags&qid=1679388204&sprefix=ba%2Caps%2C283&sr=8-15,ADISA Light Weight Laptop Backpack 32 Ltrs,499,4.0,"(5,646)","Adjustable Shoulder Handles / Two Bottle holders / Padded Handle / Reflector Logo
Dimensions : LxWxH- 31 x 18 x 47 cms
Laptop : 15.6 inches and below (Bigger than 15.6 not recommended)
No. of Compartments : 3 with full padding
NOT INCLUDED : NO RAIN COVER, Laptop, Headphones & Cable (Images only for display)
",B07F3X45WZ,,ADISA
https://www.amazon.in/ADISA-Laptop-Backpack-Office-College/dp/B0BPVLXD53/ref=sr_1_16?crid=2M096C61O4MLT&keywords=bags&qid=1679388204&sprefix=ba%2Caps%2C283&sr=8-16,ADISA 35L Large Laptop Backpack Office Bag College Travel Back Pack with rain Cover (Grey),599,4.0,(31),"Material: Water Resistant Strong Polyester
Compartments: 2 with padding
Laptop Size: 15.6 inch and below
Dimensions: LxWxH - 11 x 6 x 18 inches
Reflector Logo / Adjustable Padded Shoulder Straps / 2 Bottle holders / Padded Top Handle / Rain Cover
",B0BPVLXD53,,ADISA
https://www.amazon.in/Half-Moon-Backpack-Luggage-Compartment/dp/B09VCLZ3K4/ref=sr_1_17?crid=2M096C61O4MLT&keywords=bags&qid=1679388295&sprefix=ba%2Caps%2C283&sr=8-17,Half Moon Large 37L Laptop Bag Backpack for menं Women Boys and Girls Luggage Travel Bags with 17.3 inches Laptop Compartment & Rain Cover,849,3.9,"(2,340)","SPACIOUS AND LIGHTWEIGHT: Light weight and spacious laptop backpack with 3 compartments. One compartment is for carrying laptop inside (Upto 17 inches), with padding for safety, and space for laptop accessories like charger, etc. Second large compartment for books, files and all your day to day essentials. And third compartment is for your extra stuff. It has provision for holding bottles on both sides and has padded shoulder straps for your comfort<br> <br>
COMFORT WITH QUALITY: This Backpack has Wide, Padded and Adjustable shoulder straps and Padded Back for comfort in carrying heavy items. Stitched properly and Bartacks on every pressure point for extra durability. Made with strong yet light weight polyester fabric with heavy zippers. It also comes with a Rain cover so that you can travel during rainy season without any problem. This backpack be used by everyone be it men? , women? , boys , girls.<br> <br>
SMART & TRENDY LOOKS: This Large rucksack bag is smart, trendy and stylish in looks. The multipurpose rucksack bacpack looks smart, athletic and venturesome and the blend of grey and red makes it appear exquisite. Your hiking trips, mountaineering experience cannot get completed without this amazing trekking backpack.<br> <br>
ENDURING & LONG LASTING: This trekking backpack bag is made up of highly durable material, which makes it suitable for all weather conditions including heavy rains and extreme scorching heat. It will not only keep the inside stuff safe but will also resist damage to itself.;Style Name: Casual; Pocket Description: Utility Pocket; Compartment Description: Up To 17 Inches; Age Range Description: Adult<br>;Pattern Name: Solid <br>
OTHER FEATURES: Rain Cover, 17 inch Laptop compartment, Internal Organiser(Small Pockets), Strong and durable zippers, Adjustable Shoulder Handles (Straps) , 2 Bottle/Umbrella holders , Padded Handle , Padded Laptop Compartment , Ergonomic Design, Reflector Logo, etc<br> <br>
",B09VCLZ3K4,"This backpack is lightweight water-resistant, capacity of approx 37 Ltr, has a soft and ventilated back panel, and is perfect for carrying all your necessities. Adjustable and breathable padded shoulder strap to meet different requirements for both men and women; made from highly rip and water-resistant polyester fabric, provide strengthen and long-lasting performance; roomy enough for your traveling requirements also having a Rain cover.",Half Moon
https://www.amazon.in/Gear-Black-Laptop-Backpack-LBPASPIRE0104/dp/B075MK4TXP/ref=sr_1_18?crid=2M096C61O4MLT&keywords=bags&qid=1679388295&sprefix=ba%2Caps%2C283&sr=8-18,Gear Aspire 30L Water Restant Office Laptop Bag/Backpack for Men/Women/(Black),"1,131",4.3,"(5,161)","Outer Material: Polyester, Color: Black
Water Resistance: Water resistant
Capacity: 30 liters; Dimensions: 50 cms x 34 cms x 18 cms (LxWxH); Number of compartments: 2
Laptop Compatibility: Yes, Laptop Size: 17, Strap Type: Adjustable,
Closure Type: Zipper; Pocket Description: Utility Pocket; Special Features: Laptop Compartment; Age Range Description: Adult; Style Name: Traditional Backpacks
",B075MK4TXP,,Gear
https://www.amazon.in/Rucksack-Travel-Backpack-Trekking-Compartment/dp/B07YDGQQN5/ref=sr_1_19?crid=2M096C61O4MLT&keywords=bags&qid=1679388295&sprefix=ba%2Caps%2C283&sr=8-19,"Fur Jaden 55 LTR Rucksack Travel Backpack Bag for Trekking, Hiking with Shoe Compartment",839,4.2,"(4,957)","Large sized black and grey colour trekking rucksack for men and women for travel use as well as for trendy college and school students. Huge compartment size that can fit upto several pairs of clothes with ease with separate pocket for shoesMultiple pockets for other accessories and water bottle<br>
External clips to hold a yoga mat on the backside available with this rucksack. Also available on both sides of the rucksack are additional clips which can be used to carry camera stands as well as other climbing equipments<br>
The rucksack features a sleek and ergonomic design with a balanced weight distribution through its shoulder straps and waist strapsThis makes this product a suitable alternative to bulky and unsightly rucksacksThe compact design of this trekking bag helps you to rest it comfortably on your shoulders while accommodating all your essentials with ease<br>
Capacity: 55 L ; weight: 700 grams; dimensions: 35 cms x 25 cms x 65 cms (LxWxH); 1 Year manufacturer warranty against defects; Lining Description: Polyester; Special Features: Back Padding; Pocket Description: Utility Pocket; Style Name: Rucksack Backpacks; Closure Type: Zipper; Age Range Description: Adult; Color Name: Black Grey<br>
Water Resistance Level: Water Resistant; Warranty Description: 1 Year Manufacturer Warranty Against Defects Only<br>
",B07YDGQQN5,,FUR JADEN
